{
	"types":{
		"java.util.Date":{
			"alias":"date",
			"optional":true
		},
		"com.weidai.common.domain.response.ReplyMsgResp":{
			"optional":true,
			"properties":{
				"replyType":{
					"optional":true,
					"type":"byte"
				},
				"wxRules":{
					"optional":true,
					"type":"com.weidai.model.ext.ReplyConcatResp[]"
				},
				"replySwitch":{
					"optional":true,
					"type":"byte"
				}
			}
		},
		"com.weidai.common.domain.request.ReplyMsgReq.WxMatch":{
			"optional":true,
			"properties":{
				"matchType":{
					"optional":true,
					"type":"java.lang.Byte"
				},
				"keyword":{
					"optional":true,
					"type":"java.lang.String"
				}
			}
		},
		"com.weidai.model.WxReplyRule":{
			"optional":true,
			"properties":{
				"replyType":{
					"optional":true,
					"type":"java.lang.Byte"
				},
				"createTime":{
					"optional":true,
					"type":"java.util.Date"
				},
				"switchId":{
					"optional":true,
					"type":"java.lang.Integer"
				},
				"gzhAppid":{
					"optional":true,
					"type":"java.lang.String"
				},
				"ruleName":{
					"optional":true,
					"type":"java.lang.String"
				},
				"id":{
					"optional":true,
					"type":"java.lang.Integer"
				},
				"originalId":{
					"optional":true,
					"type":"java.lang.String"
				}
			}
		},
		"com.weidai.model.WxReplyMsg":{
			"optional":true,
			"properties":{
				"replyRuleId":{
					"optional":true,
					"type":"java.lang.Integer"
				},
				"msgType":{
					"optional":true,
					"type":"java.lang.String"
				},
				"hqmusicUrl":{
					"optional":true,
					"type":"java.lang.String"
				},
				"musicUrl":{
					"optional":true,
					"type":"java.lang.String"
				},
				"description":{
					"optional":true,
					"type":"java.lang.String"
				},
				"mediaid":{
					"optional":true,
					"type":"java.lang.String"
				},
				"title":{
					"optional":true,
					"type":"java.lang.String"
				},
				"content":{
					"optional":true,
					"type":"java.lang.String"
				},
				"replySwitchId":{
					"optional":true,
					"type":"java.lang.Integer"
				},
				"thumbMediaid":{
					"optional":true,
					"type":"java.lang.String"
				},
				"createTime":{
					"optional":true,
					"type":"java.util.Date"
				},
				"gzhAppid":{
					"optional":true,
					"type":"java.lang.String"
				},
				"cardId":{
					"optional":true,
					"type":"java.lang.String"
				},
				"msgKey":{
					"optional":true,
					"type":"java.lang.String"
				},
				"id":{
					"optional":true,
					"type":"java.lang.Integer"
				},
				"originalId":{
					"optional":true,
					"type":"java.lang.String"
				}
			}
		},
		"org.springframework.http.ResponseEntity<T>":{
			"optional":true,
			"properties":{
				"headers":{
					"optional":true,
					"type":"org.springframework.http.HttpHeaders"
				},
				"body":{
					"optional":true,
					"type":"T"
				}
			}
		},
		"java.lang.Integer":{
			"alias":"number",
			"optional":true
		},
		"long":{
			"alias":"number",
			"optional":true
		},
		"me.chanjar.weixin.mp.bean.material.WxMpMaterialNewsBatchGetResult":{
			"optional":true,
			"properties":{
				"totalCount":{
					"optional":true,
					"type":"int"
				},
				"items":{
					"optional":true,
					"type":"me.chanjar.weixin.mp.bean.material.WxMpMaterialNewsBatchGetResult.WxMaterialNewsBatchGetNewsItem[]"
				},
				"itemCount":{
					"optional":true,
					"type":"int"
				}
			}
		},
		"com.weidai.common.Enum.WxEnums.ReplySourceType":{
			"optional":true,
			"properties":{
				"subscribe":{
					"default":0
				},
				"matchkeyword":{
					"default":1
				},
				"other":{
					"default":2
				}
			}
		},
		"com.weidai.model.WxReplyMatch":{
			"optional":true,
			"properties":{
				"createTime":{
					"optional":true,
					"type":"java.util.Date"
				},
				"gzhAppid":{
					"optional":true,
					"type":"java.lang.String"
				},
				"matchType":{
					"optional":true,
					"type":"java.lang.Byte"
				},
				"id":{
					"optional":true,
					"type":"java.lang.Integer"
				},
				"originalId":{
					"optional":true,
					"type":"java.lang.String"
				},
				"keyword":{
					"optional":true,
					"type":"java.lang.String"
				},
				"ruleId":{
					"optional":true,
					"type":"java.lang.Integer"
				}
			}
		},
		"springfox.documentation.swagger.web.UiConfiguration":{
			"optional":true,
			"properties":{
				"defaultModelRendering":{
					"optional":true,
					"type":"java.lang.String"
				},
				"docExpansion":{
					"optional":true,
					"type":"java.lang.String"
				},
				"showRequestHeaders":{
					"optional":true,
					"type":"boolean"
				},
				"validatorUrl":{
					"optional":true,
					"type":"java.lang.String"
				},
				"jsonEditor":{
					"optional":true,
					"type":"boolean"
				},
				"apisSorter":{
					"optional":true,
					"type":"java.lang.String"
				},
				"supportedSubmitMethods":{
					"optional":true,
					"type":"java.lang.String[]"
				},
				"requestTimeout":{
					"optional":true,
					"type":"java.lang.Long"
				}
			}
		},
		"java.lang.Long":{
			"alias":"number",
			"optional":true
		},
		"me.chanjar.weixin.mp.bean.material.WxMpMaterialNews.WxMpMaterialNewsArticle":{
			"optional":true,
			"properties":{
				"showCoverPic":{
					"optional":true,
					"type":"boolean"
				},
				"thumbMediaId":{
					"optional":true,
					"type":"java.lang.String"
				},
				"onlyFansCanComment":{
					"optional":true,
					"type":"java.lang.Boolean"
				},
				"author":{
					"optional":true,
					"type":"java.lang.String"
				},
				"digest":{
					"optional":true,
					"type":"java.lang.String"
				},
				"contentSourceUrl":{
					"optional":true,
					"type":"java.lang.String"
				},
				"thumbUrl":{
					"optional":true,
					"type":"java.lang.String"
				},
				"title":{
					"optional":true,
					"type":"java.lang.String"
				},
				"needOpenComment":{
					"optional":true,
					"type":"java.lang.Boolean"
				},
				"content":{
					"optional":true,
					"type":"java.lang.String"
				},
				"url":{
					"optional":true,
					"type":"java.lang.String"
				}
			}
		},
		"java.lang.Boolean":{
			"alias":"boolean",
			"optional":true
		},
		"me.chanjar.weixin.common.bean.result.WxMediaUploadResult":{
			"optional":true,
			"properties":{
				"createdAt":{
					"optional":true,
					"type":"long"
				},
				"thumbMediaId":{
					"optional":true,
					"type":"java.lang.String"
				},
				"mediaId":{
					"optional":true,
					"type":"java.lang.String"
				},
				"type":{
					"optional":true,
					"type":"java.lang.String"
				},
				"url":{
					"optional":true,
					"type":"java.lang.String"
				}
			}
		},
		"java.lang.String":{
			"alias":"string",
			"optional":true
		},
		"me.chanjar.weixin.mp.bean.material.WxMpMaterialUploadResult":{
			"optional":true,
			"properties":{
				"errCode":{
					"optional":true,
					"type":"java.lang.Integer"
				},
				"errMsg":{
					"optional":true,
					"type":"java.lang.String"
				},
				"mediaId":{
					"optional":true,
					"type":"java.lang.String"
				},
				"url":{
					"optional":true,
					"type":"java.lang.String"
				}
			}
		},
		"java.lang.Byte":{
			"alias":"number",
			"optional":true
		},
		"com.weidai.common.domain.request.ReplyMsgReq.WxMsg":{
			"optional":true,
			"properties":{
				"msgType":{
					"optional":true,
					"type":"java.lang.String"
				},
				"thumbMediaid":{
					"optional":true,
					"type":"java.lang.String"
				},
				"hqmusicUrl":{
					"optional":true,
					"type":"java.lang.String"
				},
				"musicUrl":{
					"optional":true,
					"type":"java.lang.String"
				},
				"cardId":{
					"optional":true,
					"type":"java.lang.String"
				},
				"description":{
					"optional":true,
					"type":"java.lang.String"
				},
				"mediaid":{
					"optional":true,
					"type":"java.lang.String"
				},
				"title":{
					"optional":true,
					"type":"java.lang.String"
				},
				"content":{
					"optional":true,
					"type":"java.lang.String"
				}
			}
		},
		"me.chanjar.weixin.mp.bean.material.WxMpMaterialNewsBatchGetResult.WxMaterialNewsBatchGetNewsItem":{
			"optional":true,
			"properties":{
				"updateTime":{
					"optional":true,
					"type":"java.util.Date"
				},
				"mediaId":{
					"optional":true,
					"type":"java.lang.String"
				},
				"content":{
					"optional":true,
					"type":"me.chanjar.weixin.mp.bean.material.WxMpMaterialNews"
				}
			}
		},
		"me.chanjar.weixin.mp.bean.material.WxMpMaterialFileBatchGetResult.WxMaterialFileBatchGetNewsItem":{
			"optional":true,
			"properties":{
				"name":{
					"optional":true,
					"type":"java.lang.String"
				},
				"updateTime":{
					"optional":true,
					"type":"java.util.Date"
				},
				"mediaId":{
					"optional":true,
					"type":"java.lang.String"
				},
				"url":{
					"optional":true,
					"type":"java.lang.String"
				}
			}
		},
		"com.weidai.model.ext.ReplyConcatResp":{
			"optional":true,
			"properties":{
				"msgTypes":{
					"optional":true,
					"type":"java.lang.String"
				},
				"keywords":{
					"optional":true,
					"type":"java.lang.String"
				},
				"ruleName":{
					"optional":true,
					"type":"java.lang.String"
				},
				"ruleId":{
					"optional":true,
					"type":"int"
				}
			}
		},
		"void":{
			"alias":"void"
		},
		"springfox.documentation.swagger.web.SecurityConfiguration":{
			"optional":true,
			"properties":{
				"clientId":{
					"optional":true,
					"type":"java.lang.String"
				},
				"apiKey":{
					"optional":true,
					"type":"java.lang.String"
				},
				"appName":{
					"optional":true,
					"type":"java.lang.String"
				},
				"apiKeyName":{
					"optional":true,
					"type":"java.lang.String"
				},
				"clientSecret":{
					"optional":true,
					"type":"java.lang.String"
				},
				"realm":{
					"optional":true,
					"type":"java.lang.String"
				},
				"apiKeyVehicle":{
					"optional":true,
					"type":"springfox.documentation.swagger.web.ApiKeyVehicle"
				}
			}
		},
		"byte":{
			"alias":"number",
			"optional":true
		},
		"org.springframework.http.HttpHeaders":{